{
  "schema_version": 1,
  "task_id": "I-02",
  "title": "Datenquellen- und Rechtscheckliste „Immobilienanalyse“ als Vorlage für den Betreiber (nur Doku)",
  "module": "opportunity",
  "phase": "I",
  "status": "waiting_review",
  "planner": "claude-code",
  "responsible": "claude-code",
  "implementer": "claude-code",
  "reviewer": "claude-code",
  "base_commit": "e15bdbc",
  "branch": "claude/I-02-data-legal-checklist",
  "depends_on": [
    "F-01"
  ],
  "claims": {
    "paths": [
      "docs/ai-business/"
    ],
    "hot_files": [],
    "migration_numbers": []
  },
  "acceptance_criteria": [
    {
      "id": "AC-1",
      "criterion": "Prüffragen zu Nutzungsbedingungen, Lizenzen, Beratungsabgrenzung, Datenschutz mit Antwortfeldern für den Betreiber",
      "verification": "Review",
      "met": false
    },
    {
      "id": "AC-2",
      "criterion": "Ausdrücklich keine Rechtsberatung, keine echten Daten, keine Empfehlung ohne Quelle",
      "verification": "Review",
      "met": false
    }
  ],
  "test_requirements": [
    "Doku: Links und Formatierung prüfen"
  ],
  "budget": {
    "paid_runtime_calls_allowed": false,
    "max_cost_cents": 0,
    "max_sessions": 1,
    "target_changed_lines": 300,
    "notes": "Zweite Claude-Sitzung, Abo-Kontingent"
  },
  "lease": null,
  "waiting": null,
  "changed_files": [
    "docs/ai-business/10_DATENQUELLEN_RECHTSCHECKLISTE.md",
    "docs/ai-business/README.md"
  ],
  "implemented": [
    "Vorlage §0–§7 mit Prüffragen, Antwort-/Status-/Nachweisfeldern, K.O.-Kriterien, Mindestbedingungen für I-03"
  ],
  "tests": [
    {
      "command": "Doku-Review",
      "result": "passed",
      "detail": "Review approve, 1 minor (K.O.-Richtung)",
      "commit": "5f7888f",
      "at": "2026-10-20T13:20:00Z"
    },
    {
      "command": "Doku-Review (Nachprüfung)",
      "result": "passed",
      "detail": "approve, K.O.-Bedingungen je Frage",
      "commit": "a96acb0",
      "at": "2026-10-20T13:25:00Z"
    }
  ],
  "known_issues": [
    "Rollenabweichung: laut 04 Phase I setzt GPT Work um und Claude prüft; hier Claude-zu-Claude (Umsetzung zweite Sitzung, Prüfung Hauptsitzung). Zusätzliche GPT-Prüfung durch Betreiber möglich."
  ],
  "open_decisions": [],
  "pr": {
    "url": "https://github.com/agentstudiots-boop/affiliate-reel-agent/pull/111",
    "state": "draft",
    "merge_commit": null,
    "ci": "unknown"
  },
  "approval": {
    "reviewer": "approved",
    "operator": "pending",
    "latest_review_file": null
  },
  "next_steps": [
    "Merge durch Betreiber in architecture/ai-business-roadmap"
  ],
  "session": {
    "system": "claude-code",
    "last_checkpoint_at": "2026-10-20T13:25:00Z",
    "checkpoint_reason": "other",
    "last_commit": "a96acb0",
    "active_branch": "claude/I-02-data-legal-checklist",
    "state_summary": "Draft-PR #111 approve nach Nachprüfung",
    "decisions_made": [],
    "test_status": "Doku",
    "next_action": "Merge durch Betreiber"
  },
  "revision": 3,
  "based_on_commit": "e15bdbc",
  "updated_at": "2026-10-20T13:25:00Z",
  "log": [
    {
      "at": "2026-10-20T13:15:00Z",
      "actor": "claude-code",
      "action": "created",
      "summary": "Aufgabe angelegt, Umsetzung durch zweite Claude-Sitzung",
      "commit": "e15bdbc"
    },
    {
      "at": "2026-10-20T13:20:00Z",
      "actor": "claude-code",
      "action": "review_received",
      "summary": "Review #111: approve, 1 minor (K.O.-Richtung); Rollenabweichung vermerkt",
      "commit": "5f7888f"
    },
    {
      "at": "2026-10-20T13:25:00Z",
      "actor": "claude-code",
      "action": "approved",
      "summary": "Nachprüfung #111 @a96acb0: approve",
      "commit": "a96acb0"
    }
  ]
}
